master,script,archivo_salida,estado_ejecucion,archivo_generado,hoja_log,filas_procesadas,registros_ok,registros_por_validar,registros_inconsistentes,observacion
Ventas_Master,01_generar_ventas_master_gdrive_v3_fix.py,Ventas_Master_2025_11.xlsx,OK,SI,SI,Filas origen leídas: 2208,,Registros POR VALIDAR: 225,Registros INCONSISTENTES: 43,Proceso leído desde Log_Proceso.
Datafono_Master,02_generar_datafono_master_gdrive_v2.py,Datafono_Master_2025_11.xlsx,OK,SI,SI,Total registros consolidados: 1689,Registros OK: 701,Registros POR VALIDAR: 987,Registros INCONSISTENTES: 1,"CREDIBANCO - alerta: las fechas parecen corresponder a 2025-12, no a 2025-11."
Inventario_Master,03_generar_inventario_master_gdrive_v2.py,Inventario_Master_2025_11.xlsx,OK,SI,SI,Filas procesadas: 180,Registros OK: 177,Registros POR VALIDAR: 3,Registros INCONSISTENTES: 0,"Nota: el archivo fuente de inventario trae solo 6 columnas; cantidad, valor_unitario, descripcion_movimiento y documento_soporte se dejan vacíos/0 por diseño en esta versión."
Mermas_Master,04_generar_mermas_master_gdrive_v1.py,Mermas_Master_2025_11.xlsx,OK,SI,SI,Filas procesadas: 10,Registros OK: 9,Registros POR VALIDAR: 1,Registros INCONSISTENTES: 0,Nota: en esta versión la clasificacion_merma y subclasificacion_merma se dejan en POR_VALIDAR para revisión posterior.
Gastos_Master,05_generar_gastos_master_gdrive_v4.py,Gastos_Master_2025_11.xlsx,OK,SI,SI,Filas procesadas: 68,Registros OK: 32,Registros POR VALIDAR: 36,Registros INCONSISTENTES: 0,"Nota: esta versión asume que la materia prima no debe quedar en gastos; si aparece, se marca como POSIBLE_MALA_IMPUTACION_INVENTARIO. | Nota: la clasificación gerencial es inicial y podrá ajustarse con tabla de homologación posterior."
